{
  "schema_version": "crivo.technique/1.0.0",
  "id": "sbom-vulnerability-scanning",
  "version": "1.0.0",
  "family": "static_analysis",
  "name": "Software Bill of Materials (SBOM) Vulnerability Scanning",
  "procedure_summary": "Inspeciona o grafo de dependencias e correlaciona versoes contra bases de dados de vulnerabilidades conhecidas (CVE/NVD).",
  "input_partitioning": "Manifestos de dependencias CycloneDX e SPDX.",
  "oracle_class": "static_rule_match",
  "applicability": [
    "capability:cyclonedx",
    "capability:spdx",
    "capability:cve_matcher"
  ],
  "references": [
    {
      "id": "cyclonedx",
      "edition": "1.6.0",
      "relation": "direct_reference",
      "interpretation_limit": "Padrao OWASP CycloneDX SBOM."
    },
    {
      "id": "nist-sp-800-218",
      "edition": "1.1.0",
      "relation": "informed_by",
      "interpretation_limit": "Praticas do NIST SSDF para supply chain."
    },
    {
      "id": "trivy",
      "edition": "0.51.0",
      "relation": "tooling",
      "interpretation_limit": "Scanner de vulnerabilidades Trivy."
    }
  ],
  "rights": {
    "author": "CRIVO Core Team",
    "distribution": "open_access",
    "license_review": "verified_open"
  }
}