{
  "schema_version": "crivo.technique/1.0.0",
  "id": "statement-coverage",
  "version": "1.0.0",
  "family": "structure_based",
  "name": "Statement Coverage Testing (C0)",
  "procedure_summary": "Mede a proporcao de instrucoes e blocos basicos executados pela suite de testes.",
  "input_partitioning": "Caminhos executaveis no fluxo de controle e statements alcancaveis.",
  "oracle_class": "deterministic_predicate",
  "applicability": [
    "capability:gcov",
    "capability:lcov",
    "capability:clang_coverage"
  ],
  "references": [
    {
      "id": "iso-iec-ieee-29119-4",
      "edition": "2021",
      "relation": "direct_reference",
      "interpretation_limit": "Secao 6.2.2 sobre metricas e tecnicas de cobertura de instrucoes."
    },
    {
      "id": "gcov-lcov",
      "edition": "2.0.0",
      "relation": "tooling",
      "interpretation_limit": "Instrumentacao de cobertura via gcov."
    }
  ],
  "rights": {
    "author": "CRIVO Core Team",
    "distribution": "open_access",
    "license_review": "verified_open"
  }
}